{
 "name": "10 8",
 "relations": [
  {"name": "chn", "aliastable": "char_name", "basetable": "char_name", "cardinality": 6, "unfilteredCardinality": 3140339},
  {"name": "ci", "aliastable": "cast_info", "basetable": "cast_info", "cardinality": 36244344, "unfilteredCardinality": 36244344},
  {"name": "cn", "aliastable": "company_name", "basetable": "company_name", "cardinality": 6, "unfilteredCardinality": 234997},
  {"name": "ct", "aliastable": "company_type", "basetable": "company_type", "cardinality": 3, "unfilteredCardinality": 4},
  {"name": "mc", "aliastable": "movie_companies", "basetable": "movie_companies", "cardinality": 149915, "unfilteredCardinality": 2609129},
  {"name": "rt", "aliastable": "role_type", "basetable": "role_type", "cardinality": 12, "unfilteredCardinality": 12},
  {"name": "t", "aliastable": "title", "basetable": "title", "cardinality": 242426, "unfilteredCardinality": 2528312}
 ],
 "joins": [
  {"relations": ["t", "mc"]},
  {"relations": ["t", "ci"]},
  {"relations": ["ci", "mc"]},
  {"relations": ["chn", "ci"]},
  {"relations": ["rt", "ci"]},
  {"relations": ["cn", "mc"]},
  {"relations": ["ct", "mc"]}
 ],
 "sizes": [
  {"relations": ["chn", "ci"], "cardinality": 72},
  {"relations": ["ci", "mc"], "cardinality": 6686005},
  {"relations": ["ci", "rt"], "cardinality": 36244344},
  {"relations": ["ci", "t"], "cardinality": 3898830},
  {"relations": ["cn", "mc"], "cardinality": 0},
  {"relations": ["ct", "mc"], "cardinality": 149915},
  {"relations": ["mc", "t"], "cardinality": 12880},
  {"relations": ["chn", "ci", "mc"], "cardinality": 73},
  {"relations": ["chn", "ci", "rt"], "cardinality": 72},
  {"relations": ["chn", "ci", "t"], "cardinality": 7},
  {"relations": ["ci", "cn", "mc"], "cardinality": 0},
  {"relations": ["ci", "ct", "mc"], "cardinality": 6686005},
  {"relations": ["ci", "mc", "rt"], "cardinality": 6686005},
  {"relations": ["ci", "mc", "t"], "cardinality": 671446},
  {"relations": ["ci", "rt", "t"], "cardinality": 3898830},
  {"relations": ["cn", "ct", "mc"], "cardinality": 0},
  {"relations": ["cn", "mc", "t"], "cardinality": 0},
  {"relations": ["ct", "mc", "t"], "cardinality": 12880},
  {"relations": ["chn", "ci", "cn", "mc"], "cardinality": 0},
  {"relations": ["chn", "ci", "ct", "mc"], "cardinality": 73},
  {"relations": ["chn", "ci", "mc", "rt"], "cardinality": 73},
  {"relations": ["chn", "ci", "mc", "t"], "cardinality": 5},
  {"relations": ["chn", "ci", "rt", "t"], "cardinality": 7},
  {"relations": ["ci", "cn", "ct", "mc"], "cardinality": 0},
  {"relations": ["ci", "cn", "mc", "rt"], "cardinality": 0},
  {"relations": ["ci", "cn", "mc", "t"], "cardinality": 0},
  {"relations": ["ci", "ct", "mc", "rt"], "cardinality": 6686005},
  {"relations": ["ci", "ct", "mc", "t"], "cardinality": 671446},
  {"relations": ["ci", "mc", "rt", "t"], "cardinality": 671446},
  {"relations": ["cn", "ct", "mc", "t"], "cardinality": 0},
  {"relations": ["chn", "ci", "cn", "ct", "mc"], "cardinality": 0},
  {"relations": ["chn", "ci", "cn", "mc", "rt"], "cardinality": 0},
  {"relations": ["chn", "ci", "cn", "mc", "t"], "cardinality": 0},
  {"relations": ["chn", "ci", "ct", "mc", "rt"], "cardinality": 73},
  {"relations": ["chn", "ci", "ct", "mc", "t"], "cardinality": 5},
  {"relations": ["chn", "ci", "mc", "rt", "t"], "cardinality": 5},
  {"relations": ["ci", "cn", "ct", "mc", "rt"], "cardinality": 0},
  {"relations": ["ci", "cn", "ct", "mc", "t"], "cardinality": 0},
  {"relations": ["ci", "cn", "mc", "rt", "t"], "cardinality": 0},
  {"relations": ["ci", "ct", "mc", "rt", "t"], "cardinality": 671446},
  {"relations": ["chn", "ci", "cn", "ct", "mc", "rt"], "cardinality": 0},
  {"relations": ["chn", "ci", "cn", "ct", "mc", "t"], "cardinality": 0},
  {"relations": ["chn", "ci", "cn", "mc", "rt", "t"], "cardinality": 0},
  {"relations": ["chn", "ci", "ct", "mc", "rt", "t"], "cardinality": 5},
  {"relations": ["ci", "cn", "ct", "mc", "rt", "t"], "cardinality": 0},
  {"relations": ["chn", "ci", "cn", "ct", "mc", "rt", "t"], "cardinality": 0}
 ],
 "query": "SELECT MIN(chn.name) AS uncredited_voiced_character, MIN(t.title) AS russian_movie FROM char_name AS chn, cast_info AS ci, company_name AS cn, company_type AS ct, movie_companies AS mc, role_type AS rt, title AS t WHERE t.id = mc.movie_id AND t.id = ci.movie_id AND ci.movie_id = mc.movie_id AND chn.id = ci.person_role_id AND rt.id = ci.role_id AND cn.id = mc.company_id AND ct.id = mc.company_type_id AND (chn.name like '%Hagrid%' OR chn.name like '%Aragorn%') AND (mc.note like '%Australia%' OR mc.note like '%Germany%' OR mc.note like '%Italy%' OR mc.note like '%Brazil%' OR mc.note like '%Sweden%' OR mc.note like '%Denmark%') AND (cn.name like '%Working Title Films%' OR cn.name like '%Amblin Television%' OR cn.name like '%Studio Ghibli%' OR cn.name like '%Pixar Animation Studios%' OR cn.name like '%DreamWorks Animation%') AND t.production_year > 2006 AND t.production_year < 2009 AND ct.kind in ('distributors','production companies','miscellaneous companies')",
 "join columns": ["cn.id", "rt.id", "t.id", "ci.role_id", "mc.movie_id", "mc.company_id", "mc.company_type_id", "ct.id", "chn.id", "ci.movie_id", "ci.person_role_id"],
 "unary columns": ["t.production_year", "mc.note", "cn.name", "ct.kind", "chn.name"],
 "join expressions": [{"left": "t.id", "right": "mc.movie_id"}, {"left": "t.id", "right": "ci.movie_id"}, {"left": "ci.movie_id", "right": "mc.movie_id"}, {"left": "chn.id", "right": "ci.person_role_id"}, {"left": "rt.id", "right": "ci.role_id"}, {"left": "cn.id", "right": "mc.company_id"}, {"left": "ct.id", "right": "mc.company_type_id"}],
 "left deep tree min cost": "0",
 "left deep tree min order": "((((((cn join mc) join chn) join ci) join ct) join rt) join t)",
 "bushy deep tree min cost": "0",
 "bushy deep tree min order": "((((((cn join mc) join chn) join ci) join ct) join rt) join t)"
}