{
 "name": "10 28",
 "relations": [
  {"name": "chn", "aliastable": "char_name", "basetable": "char_name", "cardinality": 7, "unfilteredCardinality": 3140339},
  {"name": "ci", "aliastable": "cast_info", "basetable": "cast_info", "cardinality": 36244344, "unfilteredCardinality": 36244344},
  {"name": "cn", "aliastable": "company_name", "basetable": "company_name", "cardinality": 199, "unfilteredCardinality": 234997},
  {"name": "ct", "aliastable": "company_type", "basetable": "company_type", "cardinality": 4, "unfilteredCardinality": 4},
  {"name": "mc", "aliastable": "movie_companies", "basetable": "movie_companies", "cardinality": 11408, "unfilteredCardinality": 2609129},
  {"name": "rt", "aliastable": "role_type", "basetable": "role_type", "cardinality": 12, "unfilteredCardinality": 12},
  {"name": "t", "aliastable": "title", "basetable": "title", "cardinality": 186, "unfilteredCardinality": 2528312}
 ],
 "joins": [
  {"relations": ["t", "mc"]},
  {"relations": ["t", "ci"]},
  {"relations": ["ci", "mc"]},
  {"relations": ["chn", "ci"]},
  {"relations": ["rt", "ci"]},
  {"relations": ["cn", "mc"]},
  {"relations": ["ct", "mc"]}
 ],
 "sizes": [
  {"relations": ["chn", "ci"], "cardinality": 41},
  {"relations": ["ci", "mc"], "cardinality": 707758},
  {"relations": ["ci", "rt"], "cardinality": 36244344},
  {"relations": ["ci", "t"], "cardinality": 3072},
  {"relations": ["cn", "mc"], "cardinality": 20},
  {"relations": ["ct", "mc"], "cardinality": 11408},
  {"relations": ["mc", "t"], "cardinality": 3},
  {"relations": ["chn", "ci", "mc"], "cardinality": 15},
  {"relations": ["chn", "ci", "rt"], "cardinality": 41},
  {"relations": ["chn", "ci", "t"], "cardinality": 0},
  {"relations": ["ci", "cn", "mc"], "cardinality": 685},
  {"relations": ["ci", "ct", "mc"], "cardinality": 707758},
  {"relations": ["ci", "mc", "rt"], "cardinality": 707758},
  {"relations": ["ci", "mc", "t"], "cardinality": 403},
  {"relations": ["ci", "rt", "t"], "cardinality": 3072},
  {"relations": ["cn", "ct", "mc"], "cardinality": 20},
  {"relations": ["cn", "mc", "t"], "cardinality": 0},
  {"relations": ["ct", "mc", "t"], "cardinality": 3},
  {"relations": ["chn", "ci", "cn", "mc"], "cardinality": 0},
  {"relations": ["chn", "ci", "ct", "mc"], "cardinality": 15},
  {"relations": ["chn", "ci", "mc", "rt"], "cardinality": 15},
  {"relations": ["chn", "ci", "mc", "t"], "cardinality": 0},
  {"relations": ["chn", "ci", "rt", "t"], "cardinality": 0},
  {"relations": ["ci", "cn", "ct", "mc"], "cardinality": 685},
  {"relations": ["ci", "cn", "mc", "rt"], "cardinality": 685},
  {"relations": ["ci", "cn", "mc", "t"], "cardinality": 0},
  {"relations": ["ci", "ct", "mc", "rt"], "cardinality": 707758},
  {"relations": ["ci", "ct", "mc", "t"], "cardinality": 403},
  {"relations": ["ci", "mc", "rt", "t"], "cardinality": 403},
  {"relations": ["cn", "ct", "mc", "t"], "cardinality": 0},
  {"relations": ["chn", "ci", "cn", "ct", "mc"], "cardinality": 0},
  {"relations": ["chn", "ci", "cn", "mc", "rt"], "cardinality": 0},
  {"relations": ["chn", "ci", "cn", "mc", "t"], "cardinality": 0},
  {"relations": ["chn", "ci", "ct", "mc", "rt"], "cardinality": 15},
  {"relations": ["chn", "ci", "ct", "mc", "t"], "cardinality": 0},
  {"relations": ["chn", "ci", "mc", "rt", "t"], "cardinality": 0},
  {"relations": ["ci", "cn", "ct", "mc", "rt"], "cardinality": 685},
  {"relations": ["ci", "cn", "ct", "mc", "t"], "cardinality": 0},
  {"relations": ["ci", "cn", "mc", "rt", "t"], "cardinality": 0},
  {"relations": ["ci", "ct", "mc", "rt", "t"], "cardinality": 403},
  {"relations": ["chn", "ci", "cn", "ct", "mc", "rt"], "cardinality": 0},
  {"relations": ["chn", "ci", "cn", "ct", "mc", "t"], "cardinality": 0},
  {"relations": ["chn", "ci", "cn", "mc", "rt", "t"], "cardinality": 0},
  {"relations": ["chn", "ci", "ct", "mc", "rt", "t"], "cardinality": 0},
  {"relations": ["ci", "cn", "ct", "mc", "rt", "t"], "cardinality": 0},
  {"relations": ["chn", "ci", "cn", "ct", "mc", "rt", "t"], "cardinality": 0}
 ],
 "query": "SELECT MIN(chn.name) AS uncredited_voiced_character, MIN(t.title) AS russian_movie FROM char_name AS chn, cast_info AS ci, company_name AS cn, company_type AS ct, movie_companies AS mc, role_type AS rt, title AS t WHERE t.id = mc.movie_id AND t.id = ci.movie_id AND ci.movie_id = mc.movie_id AND chn.id = ci.person_role_id AND rt.id = ci.role_id AND cn.id = mc.company_id AND ct.id = mc.company_type_id AND cn.country_code not in ('lb','tr','ml','gb','ly','mg','am') AND (cn.name like '%Universal Pictures%' OR cn.name like '%Legendary%' OR cn.name like '%Warner Bros. Pictures%' OR cn.name like '%Walt Disney Studios%') AND (mc.note like '%Greece%') AND (t.title like '%journey%' OR t.title like '%chair%' OR t.title like '%flower%') AND t.production_year > 1994 AND (chn.name like '%Atticus Finch%' OR chn.name like '%Jack Torrance%' OR chn.name like '%Jason Bourne%' OR chn.name like '%Ethan Hunt%' OR chn.name like '%Ellen Ripley%')",
 "join columns": ["cn.id", "rt.id", "t.id", "ci.role_id", "mc.movie_id", "mc.company_id", "mc.company_type_id", "ct.id", "chn.id", "ci.movie_id", "ci.person_role_id"],
 "unary columns": ["t.production_year", "mc.note", "cn.name", "t.title", "cn.country_code", "chn.name"],
 "join expressions": [{"left": "t.id", "right": "mc.movie_id"}, {"left": "t.id", "right": "ci.movie_id"}, {"left": "ci.movie_id", "right": "mc.movie_id"}, {"left": "chn.id", "right": "ci.person_role_id"}, {"left": "rt.id", "right": "ci.role_id"}, {"left": "cn.id", "right": "mc.company_id"}, {"left": "ct.id", "right": "mc.company_type_id"}],
 "left deep tree min cost": "3",
 "left deep tree min order": "((((((mc join t) join cn) join chn) join ci) join ct) join rt)",
 "bushy deep tree min cost": "3",
 "bushy deep tree min order": "((((((mc join t) join cn) join chn) join ci) join ct) join rt)"
}