{
 "name": "12 60",
 "relations": [
  {"name": "cn", "aliastable": "company_name", "basetable": "company_name", "cardinality": 49, "unfilteredCardinality": 234997},
  {"name": "ct", "aliastable": "company_type", "basetable": "company_type", "cardinality": 3, "unfilteredCardinality": 4},
  {"name": "it1", "aliastable": "info_type", "basetable": "info_type", "cardinality": 10, "unfilteredCardinality": 113},
  {"name": "it2", "aliastable": "info_type2", "basetable": "info_type", "cardinality": 18, "unfilteredCardinality": 113},
  {"name": "mc", "aliastable": "movie_companies", "basetable": "movie_companies", "cardinality": 39339, "unfilteredCardinality": 2609129},
  {"name": "mi", "aliastable": "movie_info", "basetable": "movie_info", "cardinality": 77902, "unfilteredCardinality": 14835720},
  {"name": "mi_idx", "aliastable": "movie_info_idx", "basetable": "movie_info_idx", "cardinality": 627148, "unfilteredCardinality": 1380035},
  {"name": "t", "aliastable": "title", "basetable": "title", "cardinality": 49, "unfilteredCardinality": 2528312}
 ],
 "joins": [
  {"relations": ["t", "mi"]},
  {"relations": ["t", "mi_idx"]},
  {"relations": ["mi", "it1"]},
  {"relations": ["mi_idx", "it2"]},
  {"relations": ["t", "mc"]},
  {"relations": ["ct", "mc"]},
  {"relations": ["cn", "mc"]},
  {"relations": ["mc", "mi"]},
  {"relations": ["mc", "mi_idx"]},
  {"relations": ["mi", "mi_idx"]}
 ],
 "sizes": [
  {"relations": ["cn", "mc"], "cardinality": 8},
  {"relations": ["ct", "mc"], "cardinality": 39339},
  {"relations": ["it1", "mi"], "cardinality": 0},
  {"relations": ["it2", "mi_idx"], "cardinality": 0},
  {"relations": ["mc", "mi"], "cardinality": 20880},
  {"relations": ["mc", "mi_idx"], "cardinality": 27568},
  {"relations": ["mc", "t"], "cardinality": 1},
  {"relations": ["mi", "mi_idx"], "cardinality": 31124},
  {"relations": ["mi", "t"], "cardinality": 3},
  {"relations": ["mi_idx", "t"], "cardinality": 12},
  {"relations": ["cn", "ct", "mc"], "cardinality": 8},
  {"relations": ["cn", "mc", "mi"], "cardinality": 5},
  {"relations": ["cn", "mc", "mi_idx"], "cardinality": 13},
  {"relations": ["cn", "mc", "t"], "cardinality": 0},
  {"relations": ["ct", "mc", "mi"], "cardinality": 20880},
  {"relations": ["ct", "mc", "mi_idx"], "cardinality": 27568},
  {"relations": ["ct", "mc", "t"], "cardinality": 1},
  {"relations": ["it1", "mc", "mi"], "cardinality": 0},
  {"relations": ["it1", "mi", "mi_idx"], "cardinality": 0},
  {"relations": ["it1", "mi", "t"], "cardinality": 0},
  {"relations": ["it2", "mc", "mi_idx"], "cardinality": 0},
  {"relations": ["it2", "mi", "mi_idx"], "cardinality": 0},
  {"relations": ["it2", "mi_idx", "t"], "cardinality": 0},
  {"relations": ["mc", "mi", "mi_idx"], "cardinality": 9302},
  {"relations": ["mc", "mi", "t"], "cardinality": 0},
  {"relations": ["mc", "mi_idx", "t"], "cardinality": 0},
  {"relations": ["mi", "mi_idx", "t"], "cardinality": 1},
  {"relations": ["cn", "ct", "mc", "mi"], "cardinality": 5},
  {"relations": ["cn", "ct", "mc", "mi_idx"], "cardinality": 13},
  {"relations": ["cn", "ct", "mc", "t"], "cardinality": 0},
  {"relations": ["cn", "it1", "mc", "mi"], "cardinality": 0},
  {"relations": ["cn", "it2", "mc", "mi_idx"], "cardinality": 0},
  {"relations": ["cn", "mc", "mi", "mi_idx"], "cardinality": 8},
  {"relations": ["cn", "mc", "mi", "t"], "cardinality": 0},
  {"relations": ["cn", "mc", "mi_idx", "t"], "cardinality": 0},
  {"relations": ["ct", "it1", "mc", "mi"], "cardinality": 0},
  {"relations": ["ct", "it2", "mc", "mi_idx"], "cardinality": 0},
  {"relations": ["ct", "mc", "mi", "mi_idx"], "cardinality": 9302},
  {"relations": ["ct", "mc", "mi", "t"], "cardinality": 0},
  {"relations": ["ct", "mc", "mi_idx", "t"], "cardinality": 0},
  {"relations": ["it1", "it2", "mi", "mi_idx"], "cardinality": 0},
  {"relations": ["it1", "mc", "mi", "mi_idx"], "cardinality": 0},
  {"relations": ["it1", "mc", "mi", "t"], "cardinality": 0},
  {"relations": ["it1", "mi", "mi_idx", "t"], "cardinality": 0},
  {"relations": ["it2", "mc", "mi", "mi_idx"], "cardinality": 0},
  {"relations": ["it2", "mc", "mi_idx", "t"], "cardinality": 0},
  {"relations": ["it2", "mi", "mi_idx", "t"], "cardinality": 0},
  {"relations": ["mc", "mi", "mi_idx", "t"], "cardinality": 0},
  {"relations": ["cn", "ct", "it1", "mc", "mi"], "cardinality": 0},
  {"relations": ["cn", "ct", "it2", "mc", "mi_idx"], "cardinality": 0},
  {"relations": ["cn", "ct", "mc", "mi", "mi_idx"], "cardinality": 8},
  {"relations": ["cn", "ct", "mc", "mi", "t"], "cardinality": 0},
  {"relations": ["cn", "ct", "mc", "mi_idx", "t"], "cardinality": 0},
  {"relations": ["cn", "it1", "mc", "mi", "mi_idx"], "cardinality": 0},
  {"relations": ["cn", "it1", "mc", "mi", "t"], "cardinality": 0},
  {"relations": ["cn", "it2", "mc", "mi", "mi_idx"], "cardinality": 0},
  {"relations": ["cn", "it2", "mc", "mi_idx", "t"], "cardinality": 0},
  {"relations": ["cn", "mc", "mi", "mi_idx", "t"], "cardinality": 0},
  {"relations": ["ct", "it1", "mc", "mi", "mi_idx"], "cardinality": 0},
  {"relations": ["ct", "it1", "mc", "mi", "t"], "cardinality": 0},
  {"relations": ["ct", "it2", "mc", "mi", "mi_idx"], "cardinality": 0},
  {"relations": ["ct", "it2", "mc", "mi_idx", "t"], "cardinality": 0},
  {"relations": ["ct", "mc", "mi", "mi_idx", "t"], "cardinality": 0},
  {"relations": ["it1", "it2", "mc", "mi", "mi_idx"], "cardinality": 0},
  {"relations": ["it1", "it2", "mi", "mi_idx", "t"], "cardinality": 0},
  {"relations": ["it1", "mc", "mi", "mi_idx", "t"], "cardinality": 0},
  {"relations": ["it2", "mc", "mi", "mi_idx", "t"], "cardinality": 0},
  {"relations": ["cn", "ct", "it1", "mc", "mi", "mi_idx"], "cardinality": 0},
  {"relations": ["cn", "ct", "it1", "mc", "mi", "t"], "cardinality": 0},
  {"relations": ["cn", "ct", "it2", "mc", "mi", "mi_idx"], "cardinality": 0},
  {"relations": ["cn", "ct", "it2", "mc", "mi_idx", "t"], "cardinality": 0},
  {"relations": ["cn", "ct", "mc", "mi", "mi_idx", "t"], "cardinality": 0},
  {"relations": ["cn", "it1", "it2", "mc", "mi", "mi_idx"], "cardinality": 0},
  {"relations": ["cn", "it1", "mc", "mi", "mi_idx", "t"], "cardinality": 0},
  {"relations": ["cn", "it2", "mc", "mi", "mi_idx", "t"], "cardinality": 0},
  {"relations": ["ct", "it1", "it2", "mc", "mi", "mi_idx"], "cardinality": 0},
  {"relations": ["ct", "it1", "mc", "mi", "mi_idx", "t"], "cardinality": 0},
  {"relations": ["ct", "it2", "mc", "mi", "mi_idx", "t"], "cardinality": 0},
  {"relations": ["it1", "it2", "mc", "mi", "mi_idx", "t"], "cardinality": 0},
  {"relations": ["cn", "ct", "it1", "it2", "mc", "mi", "mi_idx"], "cardinality": 0},
  {"relations": ["cn", "ct", "it1", "mc", "mi", "mi_idx", "t"], "cardinality": 0},
  {"relations": ["cn", "ct", "it2", "mc", "mi", "mi_idx", "t"], "cardinality": 0},
  {"relations": ["cn", "it1", "it2", "mc", "mi", "mi_idx", "t"], "cardinality": 0},
  {"relations": ["ct", "it1", "it2", "mc", "mi", "mi_idx", "t"], "cardinality": 0},
  {"relations": ["cn", "ct", "it1", "it2", "mc", "mi", "mi_idx", "t"], "cardinality": 0}
 ],
 "query": "SELECT MIN(cn.name) AS movie_company, MIN(mi_idx.info) AS rating, MIN(t.title) AS drama_horror_movie FROM company_name AS cn, company_type AS ct, info_type AS it1, info_type AS it2, movie_companies AS mc, movie_info AS mi, movie_info_idx AS mi_idx, title AS t WHERE t.id = mi.movie_id AND t.id = mi_idx.movie_id AND mi.info_type_id = it1.id AND mi_idx.info_type_id = it2.id AND t.id = mc.movie_id AND ct.id = mc.company_type_id AND cn.id = mc.company_id AND mc.movie_id = mi.movie_id AND mc.movie_id = mi_idx.movie_id AND mi.movie_id = mi_idx.movie_id AND ct.kind in ('production companies','special effects companies','distributors') AND (t.title like '%crystal%' OR t.title like '%spell%' OR t.title like '%shield%') AND (cn.name like '%MGM Studios%' OR cn.name like '%Paramount Pictures%' OR cn.name like '%Legendary%' OR cn.name like '%New Line Cinema%') AND cn.country_code not in ('my','fo','bt','pt','ca','ps','sa','ph','es','cl','lb') AND mi.info in ('Italian','Catalan','Galician','Czech','Slovenian','Hebrew','Danish','Portuguese','Latvian','Georgian') AND it2.info in ('locations','LD color rendition','runtimes','interviews','admissions','LD audio quality','LD analog left','biographical movies','color info','soundtrack','LD production country','production process protocol','LD status of availablility','nick names','other literature','LD frequency response','LD picture format','tech info') AND (mc.note like '%Sweden%' OR mc.note like '%Denmark%' OR mc.note like '%Italy%') AND it1.info in ('interviews','mpaa','tech info','LD original title','studios','rentals','LD color rendition','soundtrack','height','novel') AND mi_idx.info > '4.0'",
 "join columns": ["cn.id", "mi.movie_id", "it1.id", "t.id", "mi.info_type_id", "mi_idx.movie_id", "it2.id", "mc.movie_id", "mc.company_id", "mc.company_type_id", "ct.id", "mi_idx.info_type_id"],
 "unary columns": ["mi_idx.info", "it1.info", "mc.note", "cn.name", "ct.kind", "t.title", "mi.info", "cn.country_code", "it2.info"],
 "join expressions": [{"left": "t.id", "right": "mi.movie_id"}, {"left": "t.id", "right": "mi_idx.movie_id"}, {"left": "mi.info_type_id", "right": "it1.id"}, {"left": "mi_idx.info_type_id", "right": "it2.id"}, {"left": "t.id", "right": "mc.movie_id"}, {"left": "ct.id", "right": "mc.company_type_id"}, {"left": "cn.id", "right": "mc.company_id"}, {"left": "mc.movie_id", "right": "mi.movie_id"}, {"left": "mc.movie_id", "right": "mi_idx.movie_id"}, {"left": "mi.movie_id", "right": "mi_idx.movie_id"}],
 "left deep tree min cost": "0",
 "left deep tree min order": "(((((((it1 join mi) join cn) join ct) join it2) join mc) join mi_idx) join t)",
 "bushy deep tree min cost": "0",
 "bushy deep tree min order": "(((((((it1 join mi) join cn) join ct) join it2) join mc) join mi_idx) join t)"
}