{
 "name": "1 46",
 "relations": [
  {"name": "ct", "aliastable": "company_type", "basetable": "company_type", "cardinality": 1, "unfilteredCardinality": 4},
  {"name": "it", "aliastable": "info_type", "basetable": "info_type", "cardinality": 93, "unfilteredCardinality": 113},
  {"name": "mc", "aliastable": "movie_companies", "basetable": "movie_companies", "cardinality": 828424, "unfilteredCardinality": 2609129},
  {"name": "mi_idx", "aliastable": "movie_info_idx", "basetable": "movie_info_idx", "cardinality": 1380035, "unfilteredCardinality": 1380035},
  {"name": "t", "aliastable": "title", "basetable": "title", "cardinality": 2528312, "unfilteredCardinality": 2528312}
 ],
 "joins": [
  {"relations": ["ct", "mc"]},
  {"relations": ["t", "mc"]},
  {"relations": ["t", "mi_idx"]},
  {"relations": ["mc", "mi_idx"]},
  {"relations": ["it", "mi_idx"]}
 ],
 "sizes": [
  {"relations": ["ct", "mc"], "cardinality": 0},
  {"relations": ["it", "mi_idx"], "cardinality": 1380035},
  {"relations": ["mc", "mi_idx"], "cardinality": 1568646},
  {"relations": ["mc", "t"], "cardinality": 828424},
  {"relations": ["mi_idx", "t"], "cardinality": 1380035},
  {"relations": ["ct", "mc", "mi_idx"], "cardinality": 0},
  {"relations": ["ct", "mc", "t"], "cardinality": 0},
  {"relations": ["it", "mc", "mi_idx"], "cardinality": 1568646},
  {"relations": ["it", "mi_idx", "t"], "cardinality": 1380035},
  {"relations": ["mc", "mi_idx", "t"], "cardinality": 1568646},
  {"relations": ["ct", "it", "mc", "mi_idx"], "cardinality": 0},
  {"relations": ["ct", "mc", "mi_idx", "t"], "cardinality": 0},
  {"relations": ["it", "mc", "mi_idx", "t"], "cardinality": 1568646},
  {"relations": ["ct", "it", "mc", "mi_idx", "t"], "cardinality": 0}
 ],
 "query": "SELECT MIN(mc.note) AS production_note, MIN(t.title) AS movie_title, MIN(t.production_year) AS movie_year FROM company_type AS ct, info_type AS it, movie_companies AS mc, movie_info_idx AS mi_idx, title AS t WHERE ct.id = mc.company_type_id AND t.id = mc.movie_id AND t.id = mi_idx.movie_id AND mc.movie_id = mi_idx.movie_id AND it.id = mi_idx.info_type_id AND mc.note not like '%USA%' AND mc.note not like '%Sweden%' AND mc.note not like '%China%' AND mc.note not like '%Mexico%' AND ct.kind not in ('distributors','special effects companies','production companies') AND it.info not in ('gross','LD additional information','LD dialogue intellegibility','LD supplement','LD release country','languages','LD disc format','weekend gross','LD sound encoding','LD audio quality','nick names','LD frequency response','LD color information','trivia','agent address','LD video noise','screenplay-teleplay','LD picture format','death notes','LD official retail price')",
 "join columns": ["t.id", "mi_idx.movie_id", "mc.movie_id", "it.id", "mc.company_type_id", "ct.id", "mi_idx.info_type_id"],
 "unary columns": ["ct.kind", "mc.note", "it.info"],
 "join expressions": [{"left": "ct.id", "right": "mc.company_type_id"}, {"left": "t.id", "right": "mc.movie_id"}, {"left": "t.id", "right": "mi_idx.movie_id"}, {"left": "mc.movie_id", "right": "mi_idx.movie_id"}, {"left": "it.id", "right": "mi_idx.info_type_id"}],
 "left deep tree min cost": "0",
 "left deep tree min order": "((((ct join mc) join it) join mi_idx) join t)",
 "bushy deep tree min cost": "0",
 "bushy deep tree min order": "((((ct join mc) join it) join mi_idx) join t)"
}