{
 "name": "1 97",
 "relations": [
  {"name": "ct", "aliastable": "company_type", "basetable": "company_type", "cardinality": 2, "unfilteredCardinality": 4},
  {"name": "it", "aliastable": "info_type", "basetable": "info_type", "cardinality": 10, "unfilteredCardinality": 113},
  {"name": "mc", "aliastable": "movie_companies", "basetable": "movie_companies", "cardinality": 153540, "unfilteredCardinality": 2609129},
  {"name": "mi_idx", "aliastable": "movie_info_idx", "basetable": "movie_info_idx", "cardinality": 398888, "unfilteredCardinality": 1380035},
  {"name": "t", "aliastable": "title", "basetable": "title", "cardinality": 419, "unfilteredCardinality": 2528312}
 ],
 "joins": [
  {"relations": ["ct", "mc"]},
  {"relations": ["t", "mc"]},
  {"relations": ["t", "mi_idx"]},
  {"relations": ["mc", "mi_idx"]},
  {"relations": ["it", "mi_idx"]}
 ],
 "sizes": [
  {"relations": ["ct", "mc"], "cardinality": 0},
  {"relations": ["it", "mi_idx"], "cardinality": 0},
  {"relations": ["mc", "mi_idx"], "cardinality": 77783},
  {"relations": ["mc", "t"], "cardinality": 8},
  {"relations": ["mi_idx", "t"], "cardinality": 39},
  {"relations": ["ct", "mc", "mi_idx"], "cardinality": 0},
  {"relations": ["ct", "mc", "t"], "cardinality": 0},
  {"relations": ["it", "mc", "mi_idx"], "cardinality": 0},
  {"relations": ["it", "mi_idx", "t"], "cardinality": 0},
  {"relations": ["mc", "mi_idx", "t"], "cardinality": 5},
  {"relations": ["ct", "it", "mc", "mi_idx"], "cardinality": 0},
  {"relations": ["ct", "mc", "mi_idx", "t"], "cardinality": 0},
  {"relations": ["it", "mc", "mi_idx", "t"], "cardinality": 0},
  {"relations": ["ct", "it", "mc", "mi_idx", "t"], "cardinality": 0}
 ],
 "query": "SELECT MIN(mc.note) AS production_note, MIN(t.title) AS movie_title, MIN(t.production_year) AS movie_year FROM company_type AS ct, info_type AS it, movie_companies AS mc, movie_info_idx AS mi_idx, title AS t WHERE ct.id = mc.company_type_id AND t.id = mc.movie_id AND t.id = mi_idx.movie_id AND mc.movie_id = mi_idx.movie_id AND it.id = mi_idx.info_type_id AND it.info in ('printed media reviews','LD analog right','rentals','sound mix','LD catalog number','locations','admissions','nick names','copyright holder','LD number of sides') AND mi_idx.info < '10.0' AND ct.kind in ('special effects companies','miscellaneous companies') AND (mc.note like '%Australia%' OR mc.note like '%Italy%' OR mc.note like '%Canada%' OR mc.note like '%UK%' OR mc.note like '%Portugal%' OR mc.note like '%Mexico%') AND (t.title like '%window%' OR t.title like '%door%') AND t.production_year > 1997",
 "join columns": ["t.id", "mi_idx.movie_id", "mc.movie_id", "it.id", "mc.company_type_id", "ct.id", "mi_idx.info_type_id"],
 "unary columns": ["t.production_year", "mi_idx.info", "mc.note", "it.info", "ct.kind", "t.title"],
 "join expressions": [{"left": "ct.id", "right": "mc.company_type_id"}, {"left": "t.id", "right": "mc.movie_id"}, {"left": "t.id", "right": "mi_idx.movie_id"}, {"left": "mc.movie_id", "right": "mi_idx.movie_id"}, {"left": "it.id", "right": "mi_idx.info_type_id"}],
 "left deep tree min cost": "0",
 "left deep tree min order": "((((ct join mc) join it) join mi_idx) join t)",
 "bushy deep tree min cost": "0",
 "bushy deep tree min order": "((((ct join mc) join it) join mi_idx) join t)"
}