{
 "name": "32 52",
 "relations": [
  {"name": "k", "aliastable": "keyword", "basetable": "keyword", "cardinality": 134170, "unfilteredCardinality": 134170},
  {"name": "lt", "aliastable": "link_type", "basetable": "link_type", "cardinality": 17, "unfilteredCardinality": 18},
  {"name": "mk", "aliastable": "movie_keyword", "basetable": "movie_keyword", "cardinality": 4523930, "unfilteredCardinality": 4523930},
  {"name": "ml", "aliastable": "movie_link", "basetable": "movie_link", "cardinality": 29997, "unfilteredCardinality": 29997},
  {"name": "t1", "aliastable": "title", "basetable": "title", "cardinality": 580, "unfilteredCardinality": 2528312},
  {"name": "t2", "aliastable": "title2", "basetable": "title", "cardinality": 2528312, "unfilteredCardinality": 2528312}
 ],
 "joins": [
  {"relations": ["mk", "k"]},
  {"relations": ["t1", "mk"]},
  {"relations": ["ml", "t1"]},
  {"relations": ["ml", "t2"]},
  {"relations": ["lt", "ml"]},
  {"relations": ["mk", "t1"]}
 ],
 "sizes": [
  {"relations": ["k", "mk"], "cardinality": 4523930},
  {"relations": ["lt", "ml"], "cardinality": 29750},
  {"relations": ["mk", "t1"], "cardinality": 1663},
  {"relations": ["ml", "t1"], "cardinality": 6},
  {"relations": ["ml", "t2"], "cardinality": 29997},
  {"relations": ["k", "mk", "t1"], "cardinality": 1663},
  {"relations": ["lt", "ml", "t1"], "cardinality": 6},
  {"relations": ["lt", "ml", "t2"], "cardinality": 29750},
  {"relations": ["mk", "ml", "t1"], "cardinality": 8},
  {"relations": ["ml", "t1", "t2"], "cardinality": 6},
  {"relations": ["k", "mk", "ml", "t1"], "cardinality": 8},
  {"relations": ["lt", "mk", "ml", "t1"], "cardinality": 8},
  {"relations": ["lt", "ml", "t1", "t2"], "cardinality": 6},
  {"relations": ["mk", "ml", "t1", "t2"], "cardinality": 8},
  {"relations": ["k", "lt", "mk", "ml", "t1"], "cardinality": 8},
  {"relations": ["k", "mk", "ml", "t1", "t2"], "cardinality": 8},
  {"relations": ["lt", "mk", "ml", "t1", "t2"], "cardinality": 8},
  {"relations": ["k", "lt", "mk", "ml", "t1", "t2"], "cardinality": 8}
 ],
 "query": "SELECT MIN(lt.link) AS link_type, MIN(t1.title) AS first_movie, MIN(t2.title) AS second_movie FROM keyword AS k, link_type AS lt, movie_keyword AS mk, movie_link AS ml, title AS t1, title AS t2 WHERE mk.keyword_id = k.id AND t1.id = mk.movie_id AND ml.movie_id = t1.id AND ml.linked_movie_id = t2.id AND lt.id = ml.link_type_id AND mk.movie_id = t1.id AND lt.link in ('features','featured in','edited from','follows','similar to','version of','remake of','unknown link','spin off from','spoofed in','referenced in','alternate language version of','references','edited into','spoofs','remade as','followed by') AND t1.production_year > 1997 AND t1.production_year < 2000 AND (t1.title like '%hat%' OR t1.title like '%fire%' OR t1.title like '%camera%' OR t1.title like '%starship%' OR t1.title like '%night%')",
 "join columns": ["mk.keyword_id", "lt.id", "ml.linked_movie_id", "mk.movie_id", "ml.link_type_id", "k.id", "t1.id", "ml.movie_id", "t2.id"],
 "unary columns": ["t1.title", "t1.production_year", "lt.link"],
 "join expressions": [{"left": "mk.keyword_id", "right": "k.id"}, {"left": "t1.id", "right": "mk.movie_id"}, {"left": "ml.movie_id", "right": "t1.id"}, {"left": "ml.linked_movie_id", "right": "t2.id"}, {"left": "lt.id", "right": "ml.link_type_id"}, {"left": "mk.movie_id", "right": "t1.id"}],
 "left deep tree min cost": "34",
 "bushy deep tree min cost": "34"
}