{
 "name": "32 43",
 "relations": [
  {"name": "k", "aliastable": "keyword", "basetable": "keyword", "cardinality": 520, "unfilteredCardinality": 134170},
  {"name": "lt", "aliastable": "link_type", "basetable": "link_type", "cardinality": 3, "unfilteredCardinality": 18},
  {"name": "mk", "aliastable": "movie_keyword", "basetable": "movie_keyword", "cardinality": 4523930, "unfilteredCardinality": 4523930},
  {"name": "ml", "aliastable": "movie_link", "basetable": "movie_link", "cardinality": 29997, "unfilteredCardinality": 29997},
  {"name": "t1", "aliastable": "title", "basetable": "title", "cardinality": 694, "unfilteredCardinality": 2528312},
  {"name": "t2", "aliastable": "title2", "basetable": "title", "cardinality": 1510, "unfilteredCardinality": 2528312}
 ],
 "joins": [
  {"relations": ["mk", "k"]},
  {"relations": ["t1", "mk"]},
  {"relations": ["ml", "t1"]},
  {"relations": ["ml", "t2"]},
  {"relations": ["lt", "ml"]},
  {"relations": ["mk", "t1"]}
 ],
 "sizes": [
  {"relations": ["k", "mk"], "cardinality": 28792},
  {"relations": ["lt", "ml"], "cardinality": 9091},
  {"relations": ["mk", "t1"], "cardinality": 3417},
  {"relations": ["ml", "t1"], "cardinality": 4},
  {"relations": ["ml", "t2"], "cardinality": 47},
  {"relations": ["k", "mk", "t1"], "cardinality": 52},
  {"relations": ["lt", "ml", "t1"], "cardinality": 3},
  {"relations": ["lt", "ml", "t2"], "cardinality": 30},
  {"relations": ["mk", "ml", "t1"], "cardinality": 29},
  {"relations": ["ml", "t1", "t2"], "cardinality": 0},
  {"relations": ["k", "mk", "ml", "t1"], "cardinality": 0},
  {"relations": ["lt", "mk", "ml", "t1"], "cardinality": 27},
  {"relations": ["lt", "ml", "t1", "t2"], "cardinality": 0},
  {"relations": ["mk", "ml", "t1", "t2"], "cardinality": 0},
  {"relations": ["k", "lt", "mk", "ml", "t1"], "cardinality": 0},
  {"relations": ["k", "mk", "ml", "t1", "t2"], "cardinality": 0},
  {"relations": ["lt", "mk", "ml", "t1", "t2"], "cardinality": 0},
  {"relations": ["k", "lt", "mk", "ml", "t1", "t2"], "cardinality": 0}
 ],
 "query": "SELECT MIN(lt.link) AS link_type, MIN(t1.title) AS first_movie, MIN(t2.title) AS second_movie FROM keyword AS k, link_type AS lt, movie_keyword AS mk, movie_link AS ml, title AS t1, title AS t2 WHERE mk.keyword_id = k.id AND t1.id = mk.movie_id AND ml.movie_id = t1.id AND ml.linked_movie_id = t2.id AND lt.id = ml.link_type_id AND mk.movie_id = t1.id AND (k.keyword like '%murdered%' OR k.keyword like '%betrayed%' OR k.keyword like '%magical%' OR k.keyword like '%fight%' OR k.keyword like '%vengeful%') AND lt.link in ('version of','referenced in','spin off') AND (t2.title like '%gun%' OR t2.title like '%story%') AND t2.production_year > 1992 AND t2.production_year < 2010 AND t1.production_year < 2005 AND (t1.title like '%island%' OR t1.title like '%glove%' OR t1.title like '%heart%' OR t1.title like '%suitcase%' OR t1.title like '%stone%')",
 "join columns": ["mk.keyword_id", "lt.id", "ml.linked_movie_id", "mk.movie_id", "ml.link_type_id", "k.id", "t1.id", "ml.movie_id", "t2.id"],
 "unary columns": ["t2.title", "lt.link", "t1.title", "t1.production_year", "k.keyword", "t2.production_year"],
 "join expressions": [{"left": "mk.keyword_id", "right": "k.id"}, {"left": "t1.id", "right": "mk.movie_id"}, {"left": "ml.movie_id", "right": "t1.id"}, {"left": "ml.linked_movie_id", "right": "t2.id"}, {"left": "lt.id", "right": "ml.link_type_id"}, {"left": "mk.movie_id", "right": "t1.id"}],
 "left deep tree min cost": "4",
 "bushy deep tree min cost": "4"
}