{
 "name": "5 25",
 "relations": [
  {"name": "ct", "aliastable": "company_type", "basetable": "company_type", "cardinality": 4, "unfilteredCardinality": 4},
  {"name": "it", "aliastable": "info_type", "basetable": "info_type", "cardinality": 96, "unfilteredCardinality": 113},
  {"name": "mc", "aliastable": "movie_companies", "basetable": "movie_companies", "cardinality": 1307620, "unfilteredCardinality": 2609129},
  {"name": "mi", "aliastable": "movie_info", "basetable": "movie_info", "cardinality": 22488, "unfilteredCardinality": 14835720},
  {"name": "t", "aliastable": "title", "basetable": "title", "cardinality": 5594, "unfilteredCardinality": 2528312}
 ],
 "joins": [
  {"relations": ["t", "mi"]},
  {"relations": ["t", "mc"]},
  {"relations": ["mc", "mi"]},
  {"relations": ["ct", "mc"]},
  {"relations": ["it", "mi"]}
 ],
 "sizes": [
  {"relations": ["ct", "mc"], "cardinality": 1307620},
  {"relations": ["it", "mi"], "cardinality": 3},
  {"relations": ["mc", "mi"], "cardinality": 18391},
  {"relations": ["mc", "t"], "cardinality": 5566},
  {"relations": ["mi", "t"], "cardinality": 18},
  {"relations": ["ct", "mc", "mi"], "cardinality": 18391},
  {"relations": ["ct", "mc", "t"], "cardinality": 5566},
  {"relations": ["it", "mc", "mi"], "cardinality": 50},
  {"relations": ["it", "mi", "t"], "cardinality": 0},
  {"relations": ["mc", "mi", "t"], "cardinality": 4},
  {"relations": ["ct", "it", "mc", "mi"], "cardinality": 50},
  {"relations": ["ct", "mc", "mi", "t"], "cardinality": 4},
  {"relations": ["it", "mc", "mi", "t"], "cardinality": 0},
  {"relations": ["ct", "it", "mc", "mi", "t"], "cardinality": 0}
 ],
 "query": "SELECT MIN(t.title) AS typical_european_movie FROM company_type AS ct, info_type AS it, movie_companies AS mc, movie_info AS mi, title AS t WHERE t.id = mi.movie_id AND t.id = mc.movie_id AND mc.movie_id = mi.movie_id AND ct.id = mc.company_type_id AND it.id = mi.info_type_id AND mi.info in ('Greenlandic','Korean','Hindi','Maori','Inuktitut','Afrikaans','Flemish','Hebrew','Estonian','Zulu') AND t.production_year < 1993 AND (t.title like '%ice%') AND it.info not in ('production process protocol','LD subtitles','filming dates','magazine cover photo','quotes','adaption','LD catalog number','languages','LD digital sound','nick names','LD sharpness','genres','goofs','top 250 rank','opening weekend','LD review','production dates') AND mc.note not like '%Canada%' AND mc.note not like '%China%'",
 "join columns": ["mi.movie_id", "t.id", "mi.info_type_id", "mc.movie_id", "it.id", "mc.company_type_id", "ct.id"],
 "unary columns": ["t.production_year", "mc.note", "it.info", "t.title", "mi.info"],
 "join expressions": [{"left": "t.id", "right": "mi.movie_id"}, {"left": "t.id", "right": "mc.movie_id"}, {"left": "mc.movie_id", "right": "mi.movie_id"}, {"left": "ct.id", "right": "mc.company_type_id"}, {"left": "it.id", "right": "mi.info_type_id"}],
 "left deep tree min cost": "3",
 "left deep tree min order": "((((it join mi) join t) join ct) join mc)",
 "bushy deep tree min cost": "3",
 "bushy deep tree min order": "((((it join mi) join t) join ct) join mc)"
}