{
 "name": "5 42",
 "relations": [
  {"name": "ct", "aliastable": "company_type", "basetable": "company_type", "cardinality": 3, "unfilteredCardinality": 4},
  {"name": "it", "aliastable": "info_type", "basetable": "info_type", "cardinality": 103, "unfilteredCardinality": 113},
  {"name": "mc", "aliastable": "movie_companies", "basetable": "movie_companies", "cardinality": 2609129, "unfilteredCardinality": 2609129},
  {"name": "mi", "aliastable": "movie_info", "basetable": "movie_info", "cardinality": 16709, "unfilteredCardinality": 14835720},
  {"name": "t", "aliastable": "title", "basetable": "title", "cardinality": 14, "unfilteredCardinality": 2528312}
 ],
 "joins": [
  {"relations": ["t", "mi"]},
  {"relations": ["t", "mc"]},
  {"relations": ["mc", "mi"]},
  {"relations": ["ct", "mc"]},
  {"relations": ["it", "mi"]}
 ],
 "sizes": [
  {"relations": ["ct", "mc"], "cardinality": 1334883},
  {"relations": ["it", "mi"], "cardinality": 16709},
  {"relations": ["mc", "mi"], "cardinality": 38443},
  {"relations": ["mc", "t"], "cardinality": 21},
  {"relations": ["mi", "t"], "cardinality": 0},
  {"relations": ["ct", "mc", "mi"], "cardinality": 18708},
  {"relations": ["ct", "mc", "t"], "cardinality": 12},
  {"relations": ["it", "mc", "mi"], "cardinality": 38443},
  {"relations": ["it", "mi", "t"], "cardinality": 0},
  {"relations": ["mc", "mi", "t"], "cardinality": 0},
  {"relations": ["ct", "it", "mc", "mi"], "cardinality": 18708},
  {"relations": ["ct", "mc", "mi", "t"], "cardinality": 0},
  {"relations": ["it", "mc", "mi", "t"], "cardinality": 0},
  {"relations": ["ct", "it", "mc", "mi", "t"], "cardinality": 0}
 ],
 "query": "SELECT MIN(t.title) AS typical_european_movie FROM company_type AS ct, info_type AS it, movie_companies AS mc, movie_info AS mi, title AS t WHERE t.id = mi.movie_id AND t.id = mc.movie_id AND mc.movie_id = mi.movie_id AND ct.id = mc.company_type_id AND it.id = mi.info_type_id AND (t.title like '%book%') AND t.production_year > 1995 AND t.production_year < 1999 AND ct.kind in ('special effects companies','production companies','miscellaneous companies') AND it.info not in ('LD year','LD aspect ratio','soundtrack','LD number','LD original title','essays','LD official retail price','LD group genre','LD laserdisc title','admissions') AND mi.info in ('Ukrainian','Bulgarian','Latvian','Tlingit','Croatian','Flemish','Galician','Ladino','Czech','Cantonese','Estonian','Latin')",
 "join columns": ["mi.movie_id", "t.id", "mi.info_type_id", "mc.movie_id", "it.id", "mc.company_type_id", "ct.id"],
 "unary columns": ["t.production_year", "it.info", "ct.kind", "t.title", "mi.info"],
 "join expressions": [{"left": "t.id", "right": "mi.movie_id"}, {"left": "t.id", "right": "mc.movie_id"}, {"left": "mc.movie_id", "right": "mi.movie_id"}, {"left": "ct.id", "right": "mc.company_type_id"}, {"left": "it.id", "right": "mi.info_type_id"}],
 "left deep tree min cost": "0",
 "left deep tree min order": "((((mi join t) join ct) join it) join mc)",
 "bushy deep tree min cost": "0",
 "bushy deep tree min order": "((((mi join t) join ct) join it) join mc)"
}