{
 "name": "5 79",
 "relations": [
  {"name": "ct", "aliastable": "company_type", "basetable": "company_type", "cardinality": 3, "unfilteredCardinality": 4},
  {"name": "it", "aliastable": "info_type", "basetable": "info_type", "cardinality": 96, "unfilteredCardinality": 113},
  {"name": "mc", "aliastable": "movie_companies", "basetable": "movie_companies", "cardinality": 1331679, "unfilteredCardinality": 2609129},
  {"name": "mi", "aliastable": "movie_info", "basetable": "movie_info", "cardinality": 7328, "unfilteredCardinality": 14835720},
  {"name": "t", "aliastable": "title", "basetable": "title", "cardinality": 2528312, "unfilteredCardinality": 2528312}
 ],
 "joins": [
  {"relations": ["t", "mi"]},
  {"relations": ["t", "mc"]},
  {"relations": ["mc", "mi"]},
  {"relations": ["ct", "mc"]},
  {"relations": ["it", "mi"]}
 ],
 "sizes": [
  {"relations": ["ct", "mc"], "cardinality": 1331679},
  {"relations": ["it", "mi"], "cardinality": 7328},
  {"relations": ["mc", "mi"], "cardinality": 5417},
  {"relations": ["mc", "t"], "cardinality": 1331679},
  {"relations": ["mi", "t"], "cardinality": 7328},
  {"relations": ["ct", "mc", "mi"], "cardinality": 5417},
  {"relations": ["ct", "mc", "t"], "cardinality": 1331679},
  {"relations": ["it", "mc", "mi"], "cardinality": 5417},
  {"relations": ["it", "mi", "t"], "cardinality": 7328},
  {"relations": ["mc", "mi", "t"], "cardinality": 5417},
  {"relations": ["ct", "it", "mc", "mi"], "cardinality": 5417},
  {"relations": ["ct", "mc", "mi", "t"], "cardinality": 5417},
  {"relations": ["it", "mc", "mi", "t"], "cardinality": 5417},
  {"relations": ["ct", "it", "mc", "mi", "t"], "cardinality": 5417}
 ],
 "query": "SELECT MIN(t.title) AS typical_european_movie FROM company_type AS ct, info_type AS it, movie_companies AS mc, movie_info AS mi, title AS t WHERE t.id = mi.movie_id AND t.id = mc.movie_id AND mc.movie_id = mi.movie_id AND ct.id = mc.company_type_id AND it.id = mi.info_type_id AND mc.note not like '%China%' AND mc.note not like '%Russia%' AND ct.kind in ('production companies','special effects companies','distributors') AND it.info not in ('height','death notes','agent address','LD contrast','LD color rendition','budget','LD frequency response','LD release country','LD laserdisc title','LD disc size','mpaa','LD quality program','alternate versions','weekend gross','color info','keywords','LD production country') AND mi.info in ('Hungarian','Romanian','Dari','Tlingit')",
 "join columns": ["mi.movie_id", "t.id", "mi.info_type_id", "mc.movie_id", "it.id", "mc.company_type_id", "ct.id"],
 "unary columns": ["ct.kind", "mi.info", "mc.note", "it.info"],
 "join expressions": [{"left": "t.id", "right": "mi.movie_id"}, {"left": "t.id", "right": "mc.movie_id"}, {"left": "mc.movie_id", "right": "mi.movie_id"}, {"left": "ct.id", "right": "mc.company_type_id"}, {"left": "it.id", "right": "mi.info_type_id"}],
 "left deep tree min cost": "21668",
 "left deep tree min order": "((((mc join mi) join ct) join it) join t)",
 "bushy deep tree min cost": "21668",
 "bushy deep tree min order": "((((mc join mi) join ct) join it) join t)"
}