{
 "name": "5 73",
 "relations": [
  {"name": "ct", "aliastable": "company_type", "basetable": "company_type", "cardinality": 3, "unfilteredCardinality": 4},
  {"name": "it", "aliastable": "info_type", "basetable": "info_type", "cardinality": 14, "unfilteredCardinality": 113},
  {"name": "mc", "aliastable": "movie_companies", "basetable": "movie_companies", "cardinality": 1280554, "unfilteredCardinality": 2609129},
  {"name": "mi", "aliastable": "movie_info", "basetable": "movie_info", "cardinality": 11424, "unfilteredCardinality": 14835720},
  {"name": "t", "aliastable": "title", "basetable": "title", "cardinality": 7456, "unfilteredCardinality": 2528312}
 ],
 "joins": [
  {"relations": ["t", "mi"]},
  {"relations": ["t", "mc"]},
  {"relations": ["mc", "mi"]},
  {"relations": ["ct", "mc"]},
  {"relations": ["it", "mi"]}
 ],
 "sizes": [
  {"relations": ["ct", "mc"], "cardinality": 1280554},
  {"relations": ["it", "mi"], "cardinality": 0},
  {"relations": ["mc", "mi"], "cardinality": 8701},
  {"relations": ["mc", "t"], "cardinality": 3852},
  {"relations": ["mi", "t"], "cardinality": 32},
  {"relations": ["ct", "mc", "mi"], "cardinality": 8701},
  {"relations": ["ct", "mc", "t"], "cardinality": 3852},
  {"relations": ["it", "mc", "mi"], "cardinality": 0},
  {"relations": ["it", "mi", "t"], "cardinality": 0},
  {"relations": ["mc", "mi", "t"], "cardinality": 39},
  {"relations": ["ct", "it", "mc", "mi"], "cardinality": 0},
  {"relations": ["ct", "mc", "mi", "t"], "cardinality": 39},
  {"relations": ["it", "mc", "mi", "t"], "cardinality": 0},
  {"relations": ["ct", "it", "mc", "mi", "t"], "cardinality": 0}
 ],
 "query": "SELECT MIN(t.title) AS typical_european_movie FROM company_type AS ct, info_type AS it, movie_companies AS mc, movie_info AS mi, title AS t WHERE t.id = mi.movie_id AND t.id = mc.movie_id AND mc.movie_id = mi.movie_id AND ct.id = mc.company_type_id AND it.id = mi.info_type_id AND it.info in ('nick names','LD catalog number','LD audio noise','LD color rendition','LD spaciality','countries','bottom 10 rank','LD certification','article','production dates','LD color information','adaption','rentals','LD picture format') AND mi.info in ('Georgian','Norwegian','Tatar','Albanian','Korean') AND ct.kind in ('distributors','production companies','miscellaneous companies') AND (t.title like '%spaceship%' OR t.title like '%potion%' OR t.title like '%river%' OR t.title like '%ring%' OR t.title like '%pen%') AND t.production_year > 1999 AND t.production_year < 2011 AND mc.note not like '%Japan%' AND mc.note not like '%Denmark%' AND mc.note not like '%International%'",
 "join columns": ["mi.movie_id", "t.id", "mi.info_type_id", "mc.movie_id", "it.id", "mc.company_type_id", "ct.id"],
 "unary columns": ["t.production_year", "mc.note", "it.info", "ct.kind", "t.title", "mi.info"],
 "join expressions": [{"left": "t.id", "right": "mi.movie_id"}, {"left": "t.id", "right": "mc.movie_id"}, {"left": "mc.movie_id", "right": "mi.movie_id"}, {"left": "ct.id", "right": "mc.company_type_id"}, {"left": "it.id", "right": "mi.info_type_id"}],
 "left deep tree min cost": "0",
 "left deep tree min order": "((((it join mi) join ct) join mc) join t)",
 "bushy deep tree min cost": "0",
 "bushy deep tree min order": "((((it join mi) join ct) join mc) join t)"
}