{
 "name": "5 81",
 "relations": [
  {"name": "ct", "aliastable": "company_type", "basetable": "company_type", "cardinality": 4, "unfilteredCardinality": 4},
  {"name": "it", "aliastable": "info_type", "basetable": "info_type", "cardinality": 94, "unfilteredCardinality": 113},
  {"name": "mc", "aliastable": "movie_companies", "basetable": "movie_companies", "cardinality": 88337, "unfilteredCardinality": 2609129},
  {"name": "mi", "aliastable": "movie_info", "basetable": "movie_info", "cardinality": 883667, "unfilteredCardinality": 14835720},
  {"name": "t", "aliastable": "title", "basetable": "title", "cardinality": 14, "unfilteredCardinality": 2528312}
 ],
 "joins": [
  {"relations": ["t", "mi"]},
  {"relations": ["t", "mc"]},
  {"relations": ["mc", "mi"]},
  {"relations": ["ct", "mc"]},
  {"relations": ["it", "mi"]}
 ],
 "sizes": [
  {"relations": ["ct", "mc"], "cardinality": 88337},
  {"relations": ["it", "mi"], "cardinality": 883665},
  {"relations": ["mc", "mi"], "cardinality": 57589},
  {"relations": ["mc", "t"], "cardinality": 1},
  {"relations": ["mi", "t"], "cardinality": 3},
  {"relations": ["ct", "mc", "mi"], "cardinality": 57589},
  {"relations": ["ct", "mc", "t"], "cardinality": 1},
  {"relations": ["it", "mc", "mi"], "cardinality": 57589},
  {"relations": ["it", "mi", "t"], "cardinality": 3},
  {"relations": ["mc", "mi", "t"], "cardinality": 0},
  {"relations": ["ct", "it", "mc", "mi"], "cardinality": 57589},
  {"relations": ["ct", "mc", "mi", "t"], "cardinality": 0},
  {"relations": ["it", "mc", "mi", "t"], "cardinality": 0},
  {"relations": ["ct", "it", "mc", "mi", "t"], "cardinality": 0}
 ],
 "query": "SELECT MIN(t.title) AS typical_european_movie FROM company_type AS ct, info_type AS it, movie_companies AS mc, movie_info AS mi, title AS t WHERE t.id = mi.movie_id AND t.id = mc.movie_id AND mc.movie_id = mi.movie_id AND ct.id = mc.company_type_id AND it.id = mi.info_type_id AND (mc.note like '%France%' OR mc.note like '%Japan%') AND t.production_year > 2000 AND t.production_year < 2011 AND (t.title like '%shield%' OR t.title like '%mystery%') AND mi.info in ('Tamil','Hindi','French','Kyrgyz','Portuguese','English','Arabic') AND it.info not in ('LD aspect ratio','LD group genre','quotes','weekend gross','filming dates','pictorial','LD master format','death date','crazy credits','printed media reviews','adaption','biographical movies','production dates','LD label','soundtrack','LD additional information','interviews','salary history','LD number')",
 "join columns": ["mi.movie_id", "t.id", "mi.info_type_id", "mc.movie_id", "it.id", "mc.company_type_id", "ct.id"],
 "unary columns": ["t.production_year", "mc.note", "it.info", "t.title", "mi.info"],
 "join expressions": [{"left": "t.id", "right": "mi.movie_id"}, {"left": "t.id", "right": "mc.movie_id"}, {"left": "mc.movie_id", "right": "mi.movie_id"}, {"left": "ct.id", "right": "mc.company_type_id"}, {"left": "it.id", "right": "mi.info_type_id"}],
 "left deep tree min cost": "1",
 "left deep tree min order": "((((mc join t) join mi) join ct) join it)",
 "bushy deep tree min cost": "1",
 "bushy deep tree min order": "((((mc join t) join mi) join ct) join it)"
}